{
  "schema_version": "1.0",
  "generated_at": "2026-10-21T21:37:04Z",
  "services": [
    {
      "service": "OpenAI",
      "time": "2026-10-21T21:37:03Z",
      "overall_status": "none",
      "components": [
        {
          "name": "Chat Completions",
          "status": "operational",
          "updated_at": "2026-10-16T20:01:40Z"
        },
        {
          "name": "Responses",
          "status": "operational",
          "updated_at": "2026-10-16T20:01:40Z"
        },
        {
          "name": "Agents",
          "status": "operational",
          "updated_at": "2026-10-16T20:01:40Z"
        },
        {
          "name": "Decisions",
          "status": "operational",
          "updated_at": "2026-10-16T20:01:40Z"
        },
        {
          "name": "Fine-tuning",
          "status": "operational",
          "updated_at": "2026-10-16T20:01:40Z"
        },
        {
          "name": "Embeddings",
          "status": "operational",
          "updated_at": "2026-10-16T20:01:40Z"
        },
        {
          "name": "Images",
          "status": "operational",
          "updated_at": "2026-10-16T20:01:40Z"
        },
        {
          "name": "Batch",
          "status": "operational",
          "updated_at": "2026-10-16T20:01:40Z"
        },
        {
          "name": "Audio",
          "status": "operational",
          "updated_at": "2026-10-16T20:01:40Z"
        },
        {
          "name": "Moderations",
          "status": "operational",
          "updated_at": "2026-10-16T20:01:40Z"
        },
        {
          "name": "Realtime",
          "status": "operational",
          "updated_at": "2026-10-16T20:01:40Z"
        },
        {
          "name": "Files",
          "status": "operational",
          "updated_at": "2026-10-16T20:01:40Z"
        },
        {
          "name": "Login",
          "status": "operational",
          "updated_at": "2026-10-16T20:01:40Z"
        },
        {
          "name": "Live",
          "status": "operational",
          "updated_at": "2026-10-16T20:01:40Z"
        },
        {
          "name": "Conversations",
          "status": "operational",
          "updated_at": "2026-10-16T20:01:40Z"
        },
        {
          "name": "ChatGPT Work",
          "status": "operational",
          "updated_at": "2026-10-16T20:01:40Z"
        },
        {
          "name": "Codex in ChatGPT Desktop",
          "status": "operational",
          "updated_at": "2026-10-16T20:01:40Z"
        },
        {
          "name": "Compliance API",
          "status": "operational",
          "updated_at": "2026-10-16T20:01:40Z"
        },
        {
          "name": "Search",
          "status": "operational",
          "updated_at": "2026-10-16T20:01:40Z"
        },
        {
          "name": "File uploads",
          "status": "operational",
          "updated_at": "2026-10-16T20:01:40Z"
        },
        {
          "name": "Voice mode",
          "status": "operational",
          "updated_at": "2026-10-16T20:01:40Z"
        },
        {
          "name": "GPTs",
          "status": "operational",
          "updated_at": "2026-10-16T20:01:40Z"
        },
        {
          "name": "Image Generation",
          "status": "operational",
          "updated_at": "2026-10-16T20:01:40Z"
        },
        {
          "name": "Deep Research",
          "status": "operational",
          "updated_at": "2026-10-16T20:01:40Z"
        }
      ],
      "active_incidents": [],
      "raw_score": 100,
      "confidence": 0.98,
      "updated_at": "2026-10-16T20:01:40Z",
      "source_url": "https://status.openai.com",
      "level": "ok",
      "error": null,
      "first_anomaly_at": null,
      "consecutive_anomalies": 0,
      "consecutive_recoveries": 1,
      "anomaly_seconds": null,
      "latest_incident_link": null
    },
    {
      "service": "Claude",
      "time": "2026-10-21T21:37:03Z",
      "overall_status": "none",
      "components": [
        {
          "name": "claude.ai",
          "status": "operational",
          "updated_at": "2026-10-21T20:29:17.718Z"
        },
        {
          "name": "Claude Console (platform.claude.com)",
          "status": "operational",
          "updated_at": "2026-10-13T18:00:04.315Z"
        },
        {
          "name": "Claude API (api.anthropic.com)",
          "status": "operational",
          "updated_at": "2026-10-21T20:29:17.747Z"
        },
        {
          "name": "Claude Code",
          "status": "operational",
          "updated_at": "2026-10-21T20:29:17.774Z"
        },
        {
          "name": "Claude Cowork",
          "status": "operational",
          "updated_at": "2026-10-21T20:29:17.802Z"
        },
        {
          "name": "Claude for Government",
          "status": "operational",
          "updated_at": "2026-06-30T14:45:50.487Z"
        }
      ],
      "active_incidents": [],
      "raw_score": 100,
      "confidence": 0.98,
      "updated_at": "2026-10-21T20:35:26.805Z",
      "source_url": "https://status.claude.com",
      "level": "ok",
      "error": null,
      "first_anomaly_at": null,
      "consecutive_anomalies": 0,
      "consecutive_recoveries": 52,
      "anomaly_seconds": null,
      "latest_incident_link": null
    },
    {
      "service": "Gemini",
      "time": "2026-10-21T21:37:04Z",
      "overall_status": "operational",
      "components": [],
      "active_incidents": [],
      "raw_score": 100,
      "confidence": 0.95,
      "updated_at": "2026-10-21T21:37:04Z",
      "source_url": "https://status.cloud.google.com",
      "level": "ok",
      "error": null,
      "first_anomaly_at": null,
      "consecutive_anomalies": 0,
      "consecutive_recoveries": 1622,
      "anomaly_seconds": null,
      "latest_incident_link": null
    },
    {
      "service": "Grok",
      "time": "2026-10-21T21:37:04Z",
      "overall_status": "operational",
      "components": [
        {
          "name": "xAI System",
          "status": "ok"
        }
      ],
      "active_incidents": [],
      "raw_score": 100,
      "confidence": 0.85,
      "updated_at": "2026-10-21T21:37:04.184381Z",
      "source_url": "https://status.x.ai/",
      "level": "ok",
      "error": null,
      "first_anomaly_at": null,
      "consecutive_anomalies": 0,
      "consecutive_recoveries": 291,
      "anomaly_seconds": null,
      "latest_incident_link": null
    },
    {
      "service": "AWS",
      "time": "2026-10-21T21:37:04Z",
      "overall_status": "operational",
      "components": [],
      "active_incidents": [],
      "raw_score": 100,
      "confidence": 0.97,
      "updated_at": "2026-10-21T21:37:04.283999Z",
      "source_url": "https://status.aws.amazon.com",
      "level": "ok",
      "error": null,
      "first_anomaly_at": null,
      "consecutive_anomalies": 0,
      "consecutive_recoveries": 329,
      "anomaly_seconds": null,
      "latest_incident_link": null
    }
  ],
  "alerts": []
}